[
  {
    "record_type": "reason_code_mapping",
    "mapping_id": "map-001",
    "version_id": "ver-2026-06",
    "driver_or_signal": "cash_flow_stability",
    "reason_code": "RC-101",
    "reason_text": "Insufficient cash flow stability",
    "mapping_version": "mapver-2026-06"
  },
  {
    "record_type": "reason_code_mapping",
    "mapping_id": "map-002",
    "version_id": "ver-2026-06",
    "driver_or_signal": "debt_service_coverage",
    "reason_code": "RC-102",
    "reason_text": "Debt service coverage below policy range",
    "mapping_version": "mapver-2026-06"
  },
  {
    "record_type": "reason_code_mapping",
    "mapping_id": "map-003",
    "version_id": "ver-2026-06",
    "driver_or_signal": "time_in_business",
    "reason_code": "RC-103",
    "reason_text": "Limited time in business",
    "mapping_version": "mapver-2026-06"
  },
  {
    "record_type": "reason_code_mapping",
    "mapping_id": "map-004",
    "version_id": "ver-2026-06",
    "driver_or_signal": "credit_utilization",
    "reason_code": "RC-104",
    "reason_text": "Elevated credit utilization",
    "mapping_version": "mapver-2026-06"
  },
  {
    "record_type": "reason_code_mapping",
    "mapping_id": "map-005",
    "version_id": "ver-2026-06",
    "driver_or_signal": "collateral_coverage",
    "reason_code": "RC-105",
    "reason_text": "Insufficient collateral coverage",
    "mapping_version": "mapver-2026-06"
  },
  {
    "record_type": "reason_code_mapping",
    "mapping_id": "map-006",
    "version_id": "ver-2026-06",
    "driver_or_signal": "industry_risk",
    "reason_code": "RC-106",
    "reason_text": "Elevated industry risk profile",
    "mapping_version": "mapver-2026-06"
  }
]
